{"actor_map_id":"h2epr.0892.actor-map.v1","event_id":"H2EPR-0892","mappings":[{"disposition":"named_agent","losses":["It cannot speak for every Christian faction, generate violence or casualties, control territory, request or command a foreign deployment, prove responsibility, implement Taif, or decide another faction's position."],"rationale":"P_1 persists across six episodes under two closely related names. One organizational interface preserves the source ID while separating conflict, alliance, camp-operation and negotiation records; it is not a stable militia personality or command model.","source_participant_id":"P_1","target_id":"lebanese_front_record_interface"},{"disposition":"named_agent","losses":["It cannot decide for the PLO, Lebanese Front, Syria, civilians or later militias, produce territorial control, quantify violence, or establish one coherent Muslim or leftist preference."],"rationale":"P_2 appears in the first three episodes as an organizational coalition. Its current interface ends with the exposed 1976–1978 record and does not project the label into later factions or infer internal members.","source_participant_id":"P_2","target_id":"lebanese_national_movement"},{"disposition":"named_agent","losses":["It cannot act for LNM, civilians, refugee residents, Israel or Syria, create casualties or territory, transfer aid, prove cross-border attacks, or determine a battle or ceasefire result."],"rationale":"P_3 appears in six episodes and changes operational setting. One organizational parent retains the source identity but keeps every record separately typed; it does not model leadership, fighters, refugees or one continuous strategy.","source_participant_id":"P_3","target_id":"palestine_liberation_organization"},{"disposition":"initial_context","losses":["The simulation invents no collective victim decision, casualty process, individual trajectory, sectarian identity, displacement behavior or welfare outcome."],"rationale":"P_4 appears five times only as a harmed, displaced or affected cohort. No civilian-authored response, evacuation, political choice or distribution is exposed.","source_participant_id":"P_4","target_id":"lebanese_civilian_population_context"},{"disposition":"initial_context","losses":["The opening incident is exogenous context; no attacker Agent, motive, target-selection policy, tactical action or responsibility finding is invented."],"rationale":"P_5 appears once as unidentified gunmen associated with the opening incident. The input does not supply a stable identity, organization, information set or later decision surface.","source_participant_id":"P_5","target_id":"unidentified_church_attack_context"},{"disposition":"named_agent","losses":["It cannot choose state collapse, represent unanimous government consent, command Syria, restore order, act for the Lebanese Front or create a military outcome."],"rationale":"P_6 appears twice as a weakened joint government. The Draft combines failure, collapse and a request while its narrative attributes the request to Christian leaders; the representation gate retains only a qualified public request record.","source_participant_id":"P_6","target_id":"lebanese_joint_government_interface"},{"disposition":"named_agent","losses":["It cannot decide Lebanese faction positions, generate territorial or casualty outcomes, transfer weapons, prove motives or legality, write Israel's intervention, implement constitutional reform, or establish peace effectiveness."],"rationale":"P_7 appears across six episodes in changing intervention, belligerent, mediator and post-war roles. A representation gate preserves those public records without treating a state and armed forces as one timeless preference or tactical controller.","source_participant_id":"P_7","target_id":"syrian_state_intervention_interface"},{"disposition":"named_agent","losses":["It cannot act for the Lebanese Front, determine PLO withdrawal, generate combat or civilian harm, establish occupation control, transfer aid, prove motive or legal responsibility, or write a massacre outcome."],"rationale":"P_8 appears in four episodes. The duplicated Litani wording is consolidated into one current choice, while the later full invasion and camp-entry facilitation remain separate public-record transitions.","source_participant_id":"P_8","target_id":"israeli_state_intervention_interface"},{"disposition":"initial_context","losses":["No victim behavior, casualty count, consent, responsibility finding, protection mechanism or individual trajectory is invented."],"rationale":"P_9 appears once solely as a civilian victim cohort in E6. The input exposes no resident-authored action, warning response or collective decision.","source_participant_id":"P_9","target_id":"sabra_shatila_refugee_context"},{"disposition":"named_agent","losses":["It cannot act for Syria or all Shia actors, generate siege harm or supplies, determine camp control, bind Hezbollah, implement disarmament, or establish a peace outcome."],"rationale":"P_10 appears in E7 and E8 as an organizational militia/political interface. The two records are separated by role and time; neither models members, tactics, uniform preferences or later political evolution.","source_participant_id":"P_10","target_id":"amal_movement"},{"disposition":"named_agent","losses":["It cannot act for Amal, the PLO, Syria or all Shia actors, generate combat outcomes, guarantee an exemption, implement Taif, prove disarmament status, or establish later political power."],"rationale":"P_11 appears in E7–E9 under changing militia, negotiating and post-war roles. One organizational parent separates the three records and does not back-project later prominence into the earlier event.","source_participant_id":"P_11","target_id":"hezbollah"},{"disposition":"initial_context","losses":["No starvation, injury, displacement, aid access, survival behavior, casualty total or uniform resident choice is simulated."],"rationale":"P_12 appears once as a civilian victim cohort during the War of the Camps. No collective response or member-level decision is exposed.","source_participant_id":"P_12","target_id":"palestinian_camp_resident_context"}],"occurrence_count":40,"participant_count":12,"participants":[{"appearance_refs":["draft_epg:S1/E1/P_1","draft_epg:S1/E2/P_1","draft_epg:S2/E3/P_1","draft_epg:S3/E5/P_1","draft_epg:S3/E6/P_1","draft_epg:S4/E8/P_1"],"canonical_name":"Lebanese Front (Phalangist Party / Long Gun Party Christian Militias)","observed_names":["Lebanese Front (Phalangist Party / Long Gun Party Christian Militias)","Lebanese Front (Phalangist Party Christian Militias)"],"observed_roles":["belligerent (Christian sect faction)","belligerent (Israeli ally, Christian sect faction)","negotiating party (Christian sect representative)","perpetrator of Sabra and Shatila Massacre"],"observed_types":["organization (sectarian militia coalition)"],"source_participant_id":"P_1"},{"appearance_refs":["draft_epg:S1/E1/P_2","draft_epg:S1/E2/P_2","draft_epg:S2/E3/P_2"],"canonical_name":"Lebanese National Movement (LNM, Muslim-leftist militia coalition)","observed_names":["Lebanese National Movement (LNM, Muslim-leftist militia coalition)"],"observed_roles":["belligerent (Muslim-leftist faction)"],"observed_types":["organization (sectarian militia coalition)"],"source_participant_id":"P_2"},{"appearance_refs":["draft_epg:S1/E1/P_3","draft_epg:S1/E2/P_3","draft_epg:S2/E3/P_3","draft_epg:S2/E4/P_3","draft_epg:S3/E5/P_3","draft_epg:S3/E7/P_3"],"canonical_name":"Palestine Liberation Organization (PLO)","observed_names":["Palestine Liberation Organization (PLO)"],"observed_roles":["belligerent (allied with LNM)","belligerent (allied with pro-Palestinian factions)","belligerent (defending West Beirut)"],"observed_types":["organization (cross-national militia/political group)"],"source_participant_id":"P_3"},{"appearance_refs":["draft_epg:S1/E1/P_4","draft_epg:S1/E2/P_4","draft_epg:S2/E3/P_4","draft_epg:S2/E4/P_4","draft_epg:S3/E5/P_4"],"canonical_name":"Lebanese Civilian Population (affected cohort)","observed_names":["Lebanese Civilian Population (affected cohort)"],"observed_roles":["victim"],"observed_types":["group (civilian cohort)"],"source_participant_id":"P_4"},{"appearance_refs":["draft_epg:S1/E1/P_5"],"canonical_name":"Unidentified Gunmen (conflict trigger)","observed_names":["Unidentified Gunmen (conflict trigger)"],"observed_roles":["conflict trigger"],"observed_types":["unknown (armed cell/individuals)"],"source_participant_id":"P_5"},{"appearance_refs":["draft_epg:S1/E1/P_6","draft_epg:S1/E2/P_6"],"canonical_name":"Pre-Collapse Lebanese Joint Government (led by Prime Minister Rashid Karami)","observed_names":["Pre-Collapse Lebanese Joint Government (led by Prime Minister Rashid Karami)"],"observed_roles":["failed state authority"],"observed_types":["organization (state government)"],"source_participant_id":"P_6"},{"appearance_refs":["draft_epg:S1/E2/P_7","draft_epg:S2/E3/P_7","draft_epg:S2/E4/P_7","draft_epg:S3/E7/P_7","draft_epg:S4/E8/P_7","draft_epg:S4/E9/P_7"],"canonical_name":"Syrian Arab Republic (Government & Armed Forces)","observed_names":["Syrian Arab Republic (Government & Armed Forces)"],"observed_roles":["belligerent (foreign occupying force, allied with Amal Movement)","foreign intervention force","foreign occupying force","foreign occupying force / post-war hegemon","key mediator/enforcer of Taif Agreement"],"observed_types":["organization (foreign state military/government)"],"source_participant_id":"P_7"},{"appearance_refs":["draft_epg:S2/E3/P_8","draft_epg:S2/E4/P_8","draft_epg:S3/E5/P_8","draft_epg:S3/E6/P_8"],"canonical_name":"State of Israel (Government & Israel Defense Forces)","observed_names":["State of Israel (Government & Israel Defense Forces)"],"observed_roles":["accomplice to the Sabra and Shatila Massacre","foreign intervention force","foreign intervention force / occupying force","foreign intervention force / primary invading belligerent"],"observed_type